<?xml version="1.0" encoding="UTF-8"?>
<!DOCTYPE simulation SYSTEM "simulation.dtd"> 
<simulation finalinst="100" initpop="10" maxpop="500" comfortsens="3"> 
   <grid colsnb="5" rowsnb="4"/> 
   <initialpoint xinitial="1" yinitial="1"/> 
   <finalpoint xfinal="5" yfinal="4"/>
   <specialcostzones num="1">
      <zone xinitial="2" yinitial="2" xfinal="3" yfinal="3">4</zone>
   </specialcostzones>
   <obstacles num="4">
      <obstacle xpos="2" ypos="1"/>
      <obstacle xpos="2" ypos="3"/>
      <obstacle xpos="2" ypos="4"/>
      <obstacle xpos="4" ypos="2"/>
   </obstacles>
   <events>
      <death param="10"/>
      <reproduction param="1"/>
      <move param="1"/>
   </events>
</simulation>